Checker,Annotaions,Comments,ReactCount,ReplyCount
,8,এনার সাথে ভালো ব্যবহার করুন। গালাগালি করবেননা। হতে পারে এরা অটিস্টিক কিন্তু আমাদের মতোই মানুষ। সঠিক চিকিৎসা ও সেবাযত্ন পেলে এরাও আমাদের সাথে চলাফেরা করতে পারবে। প্রধানমন্ত্রীর দৃষ্টি আকর্ষণ এইসব প্রতিবন্ধীদের ভালো একটু চিকিৎসার ব্যবস্থা করে দিন।হিজরাদে…,469,15 replies
,8,সানি লিওন কোন এক মুভির সুটিং করার জন্য বিমানে করে যাচ্ছিলেন।,297,54 replies
,8,কে তুমি বৎস ধরিয়া মৎস বেচিয়া গঞ্জে অকুল কুঞ্জে না খাইয়া তাজা কেনো তুমি ভক্ষন করিয়াছো মেয়াদ উত্তীর্ণ গাজা,40,1 reply
,8,নেইমারের প্যান্ট কেনার জন্য টাকা তোলা হচ্ছে!,304,38 replies
,8, ব্রা ফ্যানদের অনুরোধ করছি লজ্জা থাকলে বাহিরে বের হবেননা,42,16 replies
,8,ধন্যবাদ তুমি ব্রাজিলের সাপোর্টার। খুব টেনশনে ছিলাম তোমার মত পাগল কোন দল কে সাপোর্ট করে সেটা নিয়।,18,1 reply
,8,"হাগদে গেলেও ব্রাজিল,কারণ হাগুও হলুদ",20,1 reply
,8,"আপনার আশেপাশে থাকা ব্রাজিলীয়ান ফ্যানদের সঙ্গ দিন। তাদের পানির বোতল এগিয়ে দিন। ধারালো অস্ত্র, দাহ্য পদার্থ, ইঁদুর মারার ঔষধ, হারপিক, ঘুমের পিল জাতীয় মেডিসিন দূরে সরিয়ে রাখুন। সম্ভব হলে ডিশের সংযোগ কেটে দিন। স্মার্ট ফোন হাতে থাকলে এখনি সরিয়ে নিন, কোনভা…",5,1 reply
,8,লাফালাফি না করে গর্ত খুড়ে গর্তে ঢুকেন।,6,4 replies
,8,"নেইমারের প্যান্ট ছিঁড়ে গেছে, ভেতরের আন্ডার ওয়্যার দেখা যাচ্ছে, ছেঁড়া প্যান্ট পরে খেলা সম্ভব হবে কি না সন্দেহ আছে।",4,1 reply
,8,"ছোট ভাই, তোমার চোখের চশমাটা কি ঠিক আছে..???",6,1 reply
,8,ধর্ষিত ব্যক্তির জন্য সমবেদনা,2,1 reply
,8,"নেইমারের পেন্টেুর জন্য অনুদান স্বরূপ ""মেহেরবান"" গানের অনাকাঙ্ক্ষিত যে টাকা নোবেলম্যান পাবে তাহা দান করে দেওয়ার জন্য বিশেষভাবে অনুরোধ করিলাম",1,2 replies
,8,নেইমারের ছেড়া প্যান্ট কেনার জন্য অর্থের প্রয়োজন।ব্রাজিলের অর্থমন্ত্রণালয়ের সাথে কথা বলা হয়েছে। তারা বলেছে এ ব্যায় বহন করা তাদের জন্য কষ্টকর। তাই আমাদের ব্রাজিল ফ্যানদেরই কিছু করতে হবে। নেইমারকে সাহায্য করতে (সরাসরি নেইমারের পার্সোনাল নাম্বার),2,10 replies
,8,ব্রাহ্মণবাড়িয়া থেকে সস্তায় প্যান্ট ক্রয়ের ফলপ্রসু,1,4 replies
,8,নেইমারের প্যান্ট ছিড়ে গেছে।,2,5 replies
,8,শুধু পোস্ট এ হা হা রিয়েক্ট দেওয়ার জন্য বাড়ীর নিচ তালা থেকে ১০ তালায় ছাদে টেঙ্কির  উপরে উঠেছি নেটওয়ার্ক পাওয়ার জন্য এখন টেঙ্কির উপর থেকে কিভাবে নামবো বুঝতে পারছি না ।তবে জীবন স্বার্থক,2,3 replies
,8,ব্রাজিল ভাইদের জন্য ১ বালতি পানি আর নিয়ে প্রস্তুত আছি কেউ হতাশ হইয়েন না,2,
,8,মাত্তুল মারা সেরা পেরাক,2,
,8,এইজন্যই চায়না এক কবি বলিয়াছেন।,1,
,8,"আপনার আশেপাশে কোন গর্তে কিংবা খাটের তলায় লুকিয়ে থাকা ব্রাজিল ফ্যানদের জড়িয়ে ধরুন, তাদের চোখের অশ্রু মুছে দিন, তাদেরকে বোঝান জীবনটা সুন্দর, এই সুন্দর পৃথিবী দেখতে হলেও তাদের বেঁচে থাকতে হবে আরও কয়েকটা দিন তাদেরকে এর প্রয়োজনীয়তা সম্পর্কে ধারনা দিন। …",1,
,8,এর জন্যই তো বলি ছেলেটা এত সুন্দর  গান গায় কোথায় যেনো,1,
,8,"সবাই ধীরে সুহে গালাগালি করুন । ধাক্কা ধাক্কি করবেন না । সামাজিক দূরত্ব বজায় রেখে গালা - গালি করুন । উওেজিত হয়ে গালা - গালি করতে গিয়ে বানান ভুল করবেন । আমরা কমেন্ট করতে আসি না , শুধুমাত্র পড়তে আসি । তাই এমন ভাবে গালা - গালি করুন , যাতে আমাদের পড়তে …",1,
,8,"আপনার আশেপাশে কোন গর্তে কিংবা খাটের তলায় লুকিয়ে থাকা ব্রাজিল ফ্যানদের জড়িয়ে ধরুন, তাদের চোখের অশ্রু মুছে দিন, তাদেরকে বোঝান জীবনটা সুন্দর, এই সুন্দর পৃথিবী দেখতে হলেও তাদের বেঁচে থাকতে হবে আরও কয়েকটা দিন",2,
,8,কুংফুন্টিনা দের,1,
,8,নেইমারের জন্য প্যান্ট কেনার টাকা তোলা হবে। সবাই সাহায্যের হাত বাড়াই।পাশে থাকি,2,
,8,"লুঙ্গী পড়ে শুয়ে শুয়ে মোবাইল দেখতেছিলাম... হঠাৎ সামনে পোষ্টটা আসল, আর আমি এটা দেখে হাসতে হাসতে ঘর থেকে বেড়িয়ে গেলাম... রাস্তায় হাটার সময় দেখি পাড়ার ভাবী আর বৌদিরাও আমার দিকে তাকিয়ে হাসে..!!",3,
,8,"গালি তো আর এই জীবনে কম শুনলে না,তারপরেও কি ধরেনা তোমারে দাদো?",1,
,8,"একদিন নদীতে  গোসল করতে নেমেছে,,",3,
,8,নেইমারের ছেড়া প্যান্ট নিয়ে নোবেল কে দেওয়ার অনুরোধ করছি অনন্ত পাগলামি টা ধূর হোক,1,
,8,নেইমার পোলাটা ছিড়া প্যান্ট পরে খেলতেছে।,7,
,8,শরম শরম নেইমারের পেন্ট ছিরে গেল  আগে ও একবার মাঠের মধ্যে পেন্ট খুলে গেছিল,1,
,8, আপনার বাসার সামনের দোকানে খোঁজ নিয়ে দেখেন তো 7up  এর দাম বাড়ছে কিনা,2,
,8,নেইমারের প্যান্ট ছেড়ার তীব্র প্রতিবাদ জানাচ্ছি।,,
,8,"সবাই ধীরে সুস্হে গালাগালি করুন । ধাক্কা ধাক্কি করবেন না । সামাজিক দূরত্ব বজায় রেখে গালা-গালি করুন।  উওেজিত হয়ে গালা-গালি করতে গিয়ে বানান ভুল করবেন না । আমরা কমেন্ট করতে আসি না, শুধুমাএ পড়তে আসি। তাই এ",,
,8,ভাই নিচের ২টা Ping pong বলে কেটে  ওই ২টা হাতে নিয়ে Brazil চিল্লাইতে চিল্লাইতে মরে যান।,,
,8,আপনার গান শোনার চেয়ে হিরো আলমের গান শুনে সময় কাটানো অতি উত্তম,56,3 replies
,8,মেহেরবান গান আসছে আসছে শুনতে শুনতে ২ বাচ্চার মা হয়ে গেলাম তবুও মেহেরবান গান আর আসলো না,64,7 replies
,8,"মেহেরবানি করে মেহেরবান গানটা আজ রাতেই রিলিজ দেওয়ার ব্যবস্থা করুন ভাই, আজ তিনদিন হাগি নাহ, গানটা শুনতে শুনতে ক্লিয়ার একটা হাগা দেবো তাই",27,2 replies
,8,রিলিজ না হওয়া পর্যন্ত অামি ভাত খাবোনা,10,1 reply
,8,অনুরোধ করা লাগবে না।কেননা কেউ অপেক্ষাই করতেছে না।খামাখাই শুধু ভাও খাইতে চায়।,1,
,8,সবাই ভাত খাওয়া ছেড়ে দিয়ে অপেক্ষা করতেছে গানের জন্য,6,2 replies
,8,"সবাই ধীরে সুস্থে গালাগালি করুন। ধাক্কা ধাক্কি করবেন না। সামাজিক দূরত্ব বজায় রেখে গালা-গালি করুন। উত্তেজিত হয়ে গালা-গালি করতে গিয়ে বানান ভুল করবেন না। আমরা কমেন্ট করতে আসি না, শুধুমাত্র পড়তে আসি। তাই এমন ভাবে গালা-গালি করুন, যাতে আমাদের পড়তে অসুবিধা না…",1,4 replies
,8,গালি শুনারও একটা লিমিট আছে।লিমিটের বেশি গালি শুনলে তখন গালি আর ধরে না।নোবেল লিমিটের বেশি গালি শুনতেছে তাই নোবেলকে এখন আর গালি ধরে না।এজন্য আমি আর গালি দিলাম না।,2,
,8,"গানের ভিতর কাকলি ব্রান্ডের চশমা পরা চাই,,,,,,,",1,
,8,"এই মেহেরবান গানের জন্যে ৪ দিন ধরে খাওয়া দাওয়া বাথরুম বন্ধ করে বসে আছি, রিলিজ হয় না কেন",2,
,8,গানের পাখি হিরো আলমের কাছ থেকে শিক্ষা নে। কি ভাবে গান রিলিজ করতে হয়।,1,5 replies
,8,"সংঘত কারনে গালাগালি দিতে পারি না, শশুড় বাড়ির লোক জানে আমি খুবই সুশীল।   তোমার এই বা* দেখার জন্য আমরা দিন রাত পেজে তাকাই থাকি কবে এই পাপি গান ছাড়বে আর আমরা কাম্রাকাম্রি করে গান শুনবে! নাকি! ব্রু",1,
,8,আমার এমন অবস্থার জন্য একমাত্র নোবেল দায়ী,125,4 replies
,8,পৃথিবীর সবচেয়ে দামী আর দুর্লভ চশমা,21,6 replies
3,8,বৎস তোমাদের দুইজনের জন্য অনেক বিনোদন পাই,1,
,8,বন বিভাগের দৃষ্টি আকর্ষণ করছি! এই বিরল প্রজাতির বন্য সাপটিকে সংরক্ষণ করা হোক'  নয়তো যেকোনো সময় বিলুপ্ত হয়ে যেতে পারে।,1,
,8,আফ্রিকান জঙ্গলের রাজার পক্ষ থেকে শুভেচ্ছা ।,,
,8,আমি আফ্রিকান হিরো আলম বলছি কোন ভয় নেই,2,
,8,"চশমা ছাড়া নোবেল,,তেঁতুল জল ছাড়া ফুচকার মতো",1,2 replies
8,8,তোমার মত শিল্পীরা আমার কাছে গান শিখে।,,
,8,ওপসস ওখে,,
,8,চিক চিক করে বালি কোথাও নাই কাদা মুখ করে ঝকঝক হাত কেনো কালা,,
,8,শান্তিতে গোসল করতেও দেবে না,,
,8,"সবাই ধীরে সুস্থে গালাগালি করুন। ধাক্কা ধাক্কি করবেন না। সামাজিক দূরত্ব বজায় রাখুন। উত্তেজিত হয়ে গালা-গালি করতে গিয়ে বানান ভুল করবেন না। আমরা কমেন্ট করতে আসি না, শুধুমাত্র পড়তে আসি। তাই এমন ভাবে গালা-গালি করুন, যাতে আমাদের পড়তে অসুবিধা না হয়।",1,
,8,উহ আহ,3,1 reply
,8,এক গ্রামে দুই ভাই থাকত। একবার তাদের মাঝে খুব বড়সড় ঝগড়া হল। বড় ভাই রাগ করে জাপান চলে গেলো। ছোট ভাই চলে গেলো সুদান। সেখানে গিয়ে বিয়ে করলো। একটা ছেলে হলো। তারপর সে ছোট ভাই আবার দেশে ফিরে এলো। সবাই তাকে সুদানী ডাকা শুরু করলো। তাই তার ছেলের নাম হলো সুদানীর …,,
,8,"বিমানে বসে হাওয়া খেতে খেতে উগান্ডা যাচ্ছিলাম হঠাৎ এই পোষ্ট চোখের সামনে পড়লো! খুশির ঠেলায় বিমানের জানালা দিয়ে মোবাইলটা পড়ে গেল,জীবনের মায়া ভুলে আমিও লাফ দিলাম মোবাইলের জন্য ,আমাকে তো লাভ  দিতে হবে ! কিছুহ্মণ উড়ার পর উত্তর বিষুব রেখা বরাবর 4…",,
,8,কমেন্ট করতে এসে কেউ ধাক্কাধাক্কি,1,
,8,দারা আইতাছি,3,2 replies
,8,পোস্ট দেখে হাসতে হাসতে লুঙ্গি খুঁজে পাচ্ছিনা,1,
,8,তুমি আমার নাগরাজ আমি তোমার নাগ রানি,2,
,8,নোবেল আমার নিজের আত্মীয় মানে আমার দাদার  মেজো ফুফুর দেবরের ছোট ছেলের বড় বউয়ের তালতো বোন মামাতো ভাই।তাই নোবেল রে ভালা কইরা দেখছিলাম।হালায় ছোটবেলার মেলার চশমা ফিন্দা ভাব নিছিলো আইজ আমার চোখে বড় বড় ইট লাগাতে হয়।ওরে ভাই মাইনষে তোমারে কি কয় হুনো নি? তোমার ম…,13,1 reply
,8,"একদিন নদীতে সানিলিওন আর মিয়া খলিফা গোসল করতে নেমেছে,,",,
,8,ডিম পারা মুরগি বিক্রি করে ডেটা কিনি শুধু আপনার স্ট্যাটাস এর কমেন্ট পড়ার জন্য,1,1 reply
,8,নোবেল তুমি যদি এই ধরণের কাজ বন্ধ না করো তবে আমি নিজেকে তিলে তিলে শেষ করে দিব,1,1 reply
,8,"সেফুদার ডিম থেরাপি লাগবে তোমার,শুরু থেকে এখন পর্যন্ত এটুকুই আঁচ করতে পারলাম।",,
,8,এই রকম পোস্ট দেখে মনে হয় নিজের বিচিটা দরজাই চিপায় রেখে হালকা করে চাপ দিয়ে চমকে উঠি,,
,8,"নোবেল ভাই কাকলি ফার্নিচারের সেই ঐতিহাসিক  চশমা দেখতে চায় জাতি , একটু ঘুরে সামনে তাকান",352,17 replies
,8,হালকা বায়ে গিয়ে ঝাঁপিয়ে পড়লেই শান্তি  বিশ্বাস কর ভাই-- কেউ আফসোস করবে না!! দেশের মানুষ হাফ ছেড়ে বাঁচবে,46,7 replies
,8,এরপর উগান্ডা গেলে কেমন হয়,74,11 replies
,8,"হয় বাঁদিকে নয় ডানদিকে যা। এভাবে রাস্তার মাঝখান দিয়ে হাঁটিস না, যখন তখন দুর্ঘটনা ঘটে যাবে ।",38,2 replies
,8,এদের সাথে ভালো ব্যবহার করুন।গালাগালি করবেন না।হতে পারে এরা মানুষিক ভাবে অসুস্থ কিন্তু আমাদের মতোই মানুষ। সঠিক চিকিৎসা ও সেবাযত্ন পেলে এরাও আমাদের সাথে চলাফেরা করতে পারবে। প্রদানমন্ত্রীর দৃষ্টি আকর্ষণ করছি এইসব মানুষিক বিকারগস্তদের ভালো একটু চিকিৎসার ব্…,73,8 replies
,8,"যারা কমেন্ট করছেন বা করবেন দয়া করে বানান ঠিক রাখুন। উত্তেজিত অবস্থায় দ্রুত কমেন্ট করতে গিয়ে বানান ভুল করবেন না। আমরা যারা কমেন্ট পড়তে আসি, আমাদের পড়তে বেশ অসুবিধা হয়।তাছাড়া যারা গালাগালি করবেন সিরিয়াল অনুসারে করুন। অতিরিক্ত হুরোহুরিতে প্যাচ লাগতে পারে…",6,
,8,দামে কম মানে ভালো,6,1 reply
,8,ভাই প্লিজ ঐতিহ্যবাহী পাবনা জিলা স্কুলে একটু আসিস প্লিজ!,5,1 reply
,8,"হাল্কা মুতে এসে একটু বামে চেপে চেগায়া শুয়ে পরুন,আর ট্রেনের অপেক্ষা করুন।কোনোদিন একলা হাটাহাটি করতে হবেনা এইটুকু গ্যারান্টি দিচ্ছি।",5,
,8,"কলিকাতা হারবাল, শনির আখড়া বাসস্ট্যান্ড সংলগ্ন। গুরে আসুন তখন ডাক দেয়ার আগেই সবাই আসবে",3,
,8,সামনে থেকে ট্রেন আসলে কাইন্ডলি ওটার সামনে গিয়া দাঁড়াবেন একটু.... কিন্তু আমি জানি আপনি তারপরেও মরবেন না.... কারণ শয়তান সহজে মরে নাহ *--*,5,
,8,কাধে কী সবসময়ই এই একটা ভেনিটি ব্যাগ রাখা লাগে,4,1 reply
,8,দামে কম মানে ভালো,8,1 reply
,8,কেন আপনার জন্য তো পারফেক্ট জায়গা আছে উগান্ডা,3,
,8,"সবাই ধীরে সুস্থে গালাগালি করুন। ধাক্কা ধাক্কি করবেন না। সামাজিক দূরত্ব বজায় রেখে গালা-গালি করুন। উত্তেজিত হয়ে গালা-গালি করতে গিয়ে বানান ভুল করবেন না। আমরা কমেন্ট করতে আসি না, শুধুমাত্র পড়তে আসি। তাই এমন ভাবে গালা-গালি করুন, যাতে আমাদের পড়তে অসুবিধ…",2,
,8,উগান্ডা অথবা সুদান ঘুরে আসতে পারেন। আপনার জন্য শুভকামনা রইলো,4,
,8,দুম করে এবার নোবেল প্রাইজটা জিতে নেন তো দেখি,4,2 replies
,8,খোকা বাবু যায় লাল চশমা  ব্যাগ জুতা পায়  বড় বড় আপি ভাইরা সব হাহা  মাইরা যায়,4,
,8,ভায়া এডা রেললাইন।। ট্রেন এর হাগু টাগু থাকতে পারে।।হঠাৎ মুখ থুবড়ে পরবা।দেখবা লাল লাল চশমা হলুদ হয়ে গেসে,3,
,8,"এক গ্রামে এক কৃষকের গরু হারিয়ে গেছে। সারাদিন খোঁজা খুজি করে না পেয়ে শুষ্ক মুখে বাড়িতে ফিরে আসে, দাওয়ায় বসে পুত্রকে বলে ‘এক গ্লাস পানি দাও তো ভাই?’ স্ত্রী ছিলো রান্নাঘরে- এটা শুনে বলে ‘তুমি কি চোখের মাথা খেয়েছ? পাগল হয়ে গেলে যে ছেলে কে ভাই বলতেছ?’ জবাব…",3,1 reply
,8,যদি আপনার ডাক শুনে কেউ না আসে তাহলে উগাণ্ডায় যান,3,
,8,"কাল আমার পিকের সাথে আমি এই ক্যাপশন দিছি,,আর তুমিও হালায় আমার দেখে এই ক্যাপশন দিছো আজ?মানে আমি যা করব তোমাকেও তাই করতেই হবে !",3,
,8,চিড়িয়াখানা থেকে এইমাত্র একটা প্রাণী পালিয়ে  গিয়েছে,1,
,8,"ব্যাগটা সুন্দর আছেকই থেকে কিনসেন,নিশ্চয় গুলিস্থানের প্রডাক্ট",2,
