Checker,Annotaions,Comments,ReactCount,ReplyCount
,7,বতর্মানে রাজনৈতিক নেতা কর্মীর চেয়ে প্রশাসনের অগ্রাধিকার অনেক বেশি সরকার কে বিনা ভোটে ক্ষমতায় রাখতে। প্রশাসন ছাড়া টিকে থাকা impossible.,19,
,7,"দেশে পাসপোর্ট সংশোধনের সুযোগ এখনো দেওয়া হচ্ছে না, এতে করে দেশের বিশেষ করে তরুন সমাজরা মহাবিপদের মধ্যে আছে,,",10,2 replies
,7,"সেরনিয়াবাত সাদিক আব্দুল্লাহ বরিশালের মাননীয় মেয়র।তার মর্যাদা হচ্ছে প্রতিমন্ত্রী। সবচেয়ে বড় কথা তিনি আব্দুর রব সেরনিয়াবাতের নাতী।তার চেয়ে বড় আওয়ামীলীগ সাজার চেস্টা কইরেন না,পরে কিন্তু সামলাতে পারবেন না।এডমিনিস্ট্রেটিভ সার্ভিস এসোসিয়েশনের বিজ্ঞপ্তিতে কথি…",28,
,7,"সরকারে যারা আছে তারাই আমলাদের এই সাহস দিয়েছে। পরিস্থিতি এমনই হবে অদুর ভবিষ্যতে, এটা সহজেই অনুমেয়।",5,
,7,প্রশাসনের বিরুদ্ধে কথা বলার জন্য যারা ব্যারিস্টার সুমনকে বহিস্কার করার জন্য পোস্ট দিয়েছিলেন তারা এখন ক্যান প্রশাসনের বিরুদ্ধে পোস্ট দিচ্ছেন ভাই?????,28,3 replies
,7,মি. সুমান আপনার কথায় এটা প্রমানিত যে বাংলাদেশের A-Z সকল প্রশাসনিক কর্মকর্তা ছাত্রলীগ ও আওয়ামীলীগের সক্রিয় কর্মী।,9,
,7,বরিশালের মেয়র কি সুষ্ঠ ভোটে নির্বাচিত? নাকি আমলাদের দয়ায়?,10,
,7,এক এস এইয়ের স্লোগানের বিরোধিতায় আজ ব্যারিস্টার সুমন পদচ্যুত।,7,1 reply
,7,প্রতিমন্ত্রী আর মেয়রের মধ্যে কেমন সম্পর্ক সেটা জেনে নিয়েন।,189,34 replies
,7,"অন্যায় করলে শাস্তি পাওয়া তার কর্মের ফল, অন্যায়ের সাথে আপোসের বিষয়টি আপনার মূখে বড্ড বেমানান। আমার প্রশ্ন আপনার কাছে  রাজনীতিবিদ হইলে কি আইনের ঊর্ধ্বে?",24,5 replies
,7,"রাজপথে আন্দোলন সংগ্রাম করে দলকে ক্ষমতায় আনে রাজনীতিবিদরা, ফয়দা লুটে আমলারা। শরীয়তপুরের পালং এর- OC বরিশালের  UNO এর ঘটনা এ যেন এক ঘোর ""অশনি সংকেত""",145,18 replies
,7,"সেরনিয়াবাত সাদিক আব্দুল্লাহ এর উপর গুলির নির্দেশদাতাকে যারা বড়ো আওয়ামী লীগ বানাচ্ছেন। আজকে দল বিপদে পরলে এই কর্তারা গা ঢাকা দিবে। আর এই সাদিক আব্দুল্লাহ পরিবার বুলেটের ঝনঝনানি কে তোয়াক্কা না করে রাজপথে স্লোগান দিবে"" শেখ হাসিনার ভয় নাই, রাজপথ ছাড়ি নাই,আ…",79,7 replies
,7,আমলাদের সব কাজে ব্যবহার করবেন আবার আমলাদের বিপক্ষে অবস্থান নিবেন তা তো হবে না। সাধারণ জনগনকে পিটানোর জন্য পুলিশের সাথে ম্যাজিস্ট্রেট এখন সেইম ফর্মুলা আপনাদের জন্য।,3,
,7,"সরকারি দল আর সরকারি প্রশাসন একে অন্যের মধ্যে বিলীন হয়ে গেছে। দুটো যে আলাদা স্বত্ত্বা, এটা নিজেরাই মানতে চায় না। কিন্তু এই মিলমিশ টিকবে না। দুইটা দুই ধারা। প্রশাসন ও সরকারি দলের অতিরিক্ত সখ্যতার পরিনতি হবে সংঘাত। দুই গ্রুপের স্বার্থ অভিন্ন হলেও মাঠ পর্য…",,
,7,একসময় ছাত্রনেতাদের কোন কারণে পুলিশ গ্রেফতার করলে ছাত্রজনতার আন্দোলন কিংবা থানা ঘেরাও করে হলেও তাদের জেল থেকে ছাড়িয়ে আনতো।,,
,7,যখনি বরিশাল সিটি আওয়ামিলীগের ঘাটিতে রুপান্তরিত হচ্ছে তখনই কিছু লোক এই বরিশালকে আবার সাবেক জায়গায় পরিনত করার জন্য সাদেক ভাইয়ের বিরুদ্ধে কঠিন ষড়যন্ত্রে লিপ্ত হচ্ছে। সাদেক ভাই বরিশাল সিটিতে আওয়ামীলীগের একটি খুঁটি। কারা এই খুঁটিকে উফরে ফেলতে চাচ্ছে। কি তাদ…,,
,7,"ইউ এন ও এবং মেয়রের মধ্যকার বিবাধের জের ধরে বরিশাল সিটি কর্পোরেশনের ময়লা উঠানো বন্ধ এমন কি টিকা দান কর্মসূচিও বন্ধ,  তাদের বিবাধের জেরে জনগন কেন ভোগান্তিতে পড়বে? মেয়রের বা দলের পক্ষে চাপাই দেওয়ার পূর্বে দেখুন দোষ কার? আওয়ামীলীগের নেতা বা মেয়র বলে…",,
,7,"রাজনিতি কেনো জানি মাঝে মাঝে অনেক অপছন্দ হয়ে যায়, কারন যারা আলোকিত পথ দেখায় ,তাদেরকেই অন্ধকারের দিকে ঠেলা দেওয়া হয়, উনি (সাদিক আব্দুল্লাহ) মাননীয় মেয়র বরিশাল, আমার কেউ না, তবে রাজনিতিতে পরিশ্রমী নেতাদের মধ্যে উনিও একজন, আমি ওনার ফলোয়ার, ওনার লাইভ ভিডিও …",,
,7,"রাজনৈতিক দুর্বৃত্ত বলতে আওয়ামী লীগ নয়!! আমলা বলতে সকলে দুর্নীতিবাজ নয়!! আপনার কথাটি একটু দলীয়করণের আভাস দিচ্ছে,, বাট বাংলাদেশে সত্য রাজনীতি ছিল আছে ভবিষ্যতেও থাকবে--- কিছু ক্ষেত্রে ভিন্ন",,
,7,"আওয়ামীলীগ সঠিকপথে নাই, এরা কোন সমস্যার সমাধান করে না, জিয়িয়ে রাখে। সবজায়গায় অন্তরকোন্দল,  সাধারণ সম্পাদক,  সাংগঠনিক সম্পাদকদের কোন্দল মিটানোর মত জ্ঞান,  ব্যক্তিত্ব আছে কিনা সন্দেহ।",,
,7,"আওয়ামীলীগের সুসময় ২০১১ তে এসে একটি হল শাখা ছাত্রলীগের সহ সভাপতি হয়ে মুনিবুর রহমান শোভন রা যদি দুর্দিনের যোদ্ধা বনে যায়,তাহলে ৯০,৯৬ এবং ২০০১ এর পহেলা অক্টোবরের নির্বাচন পরবর্তী সময় গুলোতে যারা রাজপথে থেকে আন্দোলন সংগ্রাম করে আজকের দিন পর্যন্ত কোন পদ পদব…",,
,7,একটু অপেক্ষা করুন সকল প্রকার লীগই আঃলীগকে ডোবাবে। তাই এখনই সময় লাগাম টেনে ধরার নইলে যা হবার তাই হবে। জয় বাংলা,1,
,7,প্রতি ক্রিয়ার সমান এবং বিপরীত প্রতিক্রিয়া আছে।,,
,7,বরিশালে মেয়র সাদিক আব্দুল্লাহ সাহবের রাজনৈতিক মনমালিন্যতা রয়েছে সদর আসনের এমপি-- কর্ণেল জাহিদ ফারুকের সাথে (পানি সম্পদ প্রতিমন্ত্রী।,1,
,7,যে আওয়ামীলীগ বাংলাদেশ রচনা করেছে সেই আওয়ামীলীগের লোকেরা অপমানিত অবহেলিত অত্যাচারিত হলে মুজিব আদর্শের সৈনিকেরা চুপ করে বসে থাকবেনা। যদি স্বাধীন বাংলাদেশই না থাকতো কোথায় থেকে আসতো সুশীল আমলারা কাজেই আওয়ামীলীগের দিকে আঙ্গুল তোলার আগে দশবার ভেবে দেখা উচিত সুশীল আমলাদের।,,
,7,"আমলারা এখন সরাসরি রাজনৈতিক নেতাদের উপর ছড়ি ঘুরানো শুরু করেছে,এর পরিণতি ভালো বলে মনে হয়না।",,
,7,যেই মানুষটি সেই পর্বতের রক্তক্ষয়ী সংঘাত থামিয়েছিল। যেখানে শান্তির কোন বাতাস বইতে ছিলনা। তার জীবনের ঝুঁকি নিয়ে যে শান্তি বহমান করেছিল। সেই দক্ষিণবঙ্গের সিংহ পুরুষ আলহাজ্ব আবুল হাসানাত আব্দুল্লাহর সন্তান সেরনিয়াবাদ সাদিক আব্দুল্লাহ।  যে মেয়র করোনা পর…,,
,7,"আপনি আইন বিষয়ক শিক্ষা গ্রহণ করেছেন,তাই আইন বুঝতে পারেন। শিক্ষিত লোকের জুতা টানাও না কি ভালো।যদি সে সুশিক্ষিত হয়। আপনার মতো একজন সুশিক্ষিত লোক বরিশালের মেয়র হ‌ইলে উপযুক্ত বিবেচিত হ‌ইত।",1,
,7,"সুমন সাহেব  আপনি বাংলাদেশের বেশীরভাগ মানুষের প্রিয় ভাজন ও শ্রদ্ধার পাত্র ছিলেন, লীগের মনোগ্রাম লাগিয়ে নিজেকে কতটা প্রশ্ন বিদ্ব করেছেন তা হয়ত আপনি নিজে অনুধাবন করতে পারছেন না। এখন আবার ক্ষমতাশীল রাজনৈতিক দলে র  সাফাই  গেয়ে আমলাদেরকে হেয় করে নিজেকে আবারো…",,
,7,পুলিশের জয়বাংলা স্লোগানের বিরোধিতা করে যুবলীগের পদ হারালেন সুমন। আবার বরিশালের পুলিশ আর ইউএনও মিলে যুবলীগ ছাত্রলীগ কে পেটালো। সাদিক আবদুল্লাহর দিকে গুলি ছুরলো।তাইতো সুমন ভাই বলে মায়ের চেয়ে মাসির দরদ বেশি হলে সন্দেহ হয়।,,
,7,সেরনিয়াবাত পরিবার দক্ষিণ অঞ্চলের মানুষের কাছে একটি ভালোবাসার আবেগ অনুভুতির নাম এই পরিবারের মান ইজ্জৎ নিয়ে ছিনি মিনি কারা মোটেও উচিৎ হয়নি!!!,,
,7,"এই আমলাতন্ত্রের কারনেই আজ আওয়ামিলীগের দুঃসময়ের ত্যাগী নেতারা দল থেকে দূরে সরে আছে দলকে একদিন এর মাশুল পোয়াতে হবে, প্রশাসনের দুর্নীতি   বিরুদ্ধে কথা বলায় আমাদের উপজেলা চেয়ারম্যানকে বরখাস্ত করা হয়েছে  অথচ দুর্নীতি প্রমাণ হওয়ার পরেও ওই আমলার কিছুই হয়নি",,
,7,আপনার মতন একজন বিশিষ্ট আইনজীবী তথা ব্যারিস্টার যখন দোষ গুনের মাপকাঠি হিসেবে পরিবারকে বিবেচনা করে থাকে তখন আপনাকে দলের পদ থেকে বহিষ্কার যথার্থ হিসেবেই মনে হয়। যতদিন বাংলাদেশ পরিবারতন্ত্র থেকে বের না হবে ততদিন বাংলাদেশি হিসেবে দোষগুণ বিবেচনায় কাঠের চষমা …,,
,7,সিটি কপোরেশন পক্ষ থেকে শহরকে পরিছন্ন রাখতে ব্যানার অপসরণ করা হয়েছিল সেখানে ইউএনও রাতে বাঁধা প্রদান করেছে। সিটির কাজে কেন ইউএনও বাঁধা দিবে?,,
,7,"চাঁদপুরে মায়া বীর বিক্রমের পরিবার, নারায়ণঞ্জের উসমান পরিবার, চিটাগাং-এ মহিউদ্দিন চৌধুরী পরিবার, পুরাণ ঢাকায় হানিফ পরিবার, আর বরিশালের সেরনিয়াবাত পরিবার কোথায় কাকে শান্তিতে রাজনীতি করতে দেওয়া হচ্ছে?? তাদের বিরুদ্ধে দলের হাই-কমান্ড থেকে শুরু করে লোকাল রা…",,
,7,রাজনীতি যখন অজ্ঞ আর মাস্তান পোষে । আমলা তখন রাস্তাপায় আইন নিয়ন্ত্রনের।রাষ্ট্রযন্ত্র হয় সরকারি কর্মচারীর নিয়ন্ত্রাধীন।দেশের বর্তমান অবস্হা ইহাই। নিরাপরাধ,,
,7,নীতির চেয়ে দল বড় নয়।,,
,7,"যখন সরকারী পুলিশ বিএনপি জামাতের নেতাকর্মীদের কে আপনাদের স্বার্থ রক্ষায় গুম খুন মামলা হামলা দিয়ে অত্যাচার নিষ্ঠুর ভাবে দমন করেছে তখন আপনাদের বিবেক জাগ্রত হয়নি, আর এখন সরাসরি আওয়ামীলীগ নেতাকর্মীরা প্রকাশ্য একজন সরকারী কর্মকরতা কে একা বাড়িতে পেয়ে হামলা কর…",,
,7,"সেদিন বেশে দূরে নয়, এদেশে আওয়ামীলীগ বিএনপি একসাথে আবার আন্দোলন করতে হবে। তবে এবার স্বৈরাচারের বিরুদ্ধে নয়, গনতন্ত্র হত্যাকারী আওয়ামীলীগ সৃষ্ট আমলাতন্ত্রের বিরুদ্ধে।",,
,7,"উপসহকারী কৃষি অফিসার গন।সব জায়গায় রাজনৈতিক নেতাদের অত্যাচারের শিকার। এটার একটি আইন বাস্তবায়ন করতে হবে। যাতে উপসহকারী কৃষি অফিসার দের উপর কোনো প্রকার বাধা না আসে। আমরা চাই প্রকৃত কৃষক বীজ,সার এইগুলা পেয়ে যাক।আর চেয়ারম্যান, মেম্বাররা তাদের ভোটের জন্য অকৃ…",,
,7,"ব্যারিস্টার সুমন সাহেব আপনি আপনার পদ যাওয়ার পরেও বুঝতে পারেন নাই??আওয়ামী লীগ কি চায় রাজনীতিবিদদের কাছে রাজনীতি তাক, যদি চাইত তাহলে রাতের আধারে ভোট ডাকাতি করে বাংলার মসনদে বসে থাকতো না। এখনো সময় আছে সোজা রাস্তা ধরে।",1,
,7,যে যেই পরিবারের হউক অন্যায় কারির বিচার হবে। কিন্তু দুর্ভাগ্যের বিষয় যা আমাদের দেশে হচ্ছে না। না হওয়ার একমাত্র কারণ আবেগকে প্রশ্রয় দেওয়া বিবেককে বিতাড়িত করা। আজ সব জায়গাতেই বিবেকহীনদের জয়জয়কার।,,
,7,নিজের পায়ে নিজেরাই কুড়াল মারতেছেন আপনারা।ক্ষমতা টিকিয়ে রাখতে আমলাদের ব্যবহার করেছেন। এখন এই আমলারা আপনাদের কে মামলা দিয়ে দৌড়ানি দিতেছে।আওয়ামীলীগ এখন আমলার মামলায় বেসামাল।,,
,7,তাহলে সুমন সাহেব আপনাকে কিছু প্রশ্ন করি আপনি বলতে আছেন আওয়ামী লীগকে উপরে পুলিশে হামলা করেছে তার জন্য প্রধানমন্ত্রী জানো এটা দেখে আমার কাছে আপনার আরেকটা আবেদন আপনারা যখন পুলিশ লীগ এখন বললেই চলে নো প্রবলেম যখন বিএনপি'র ঐদিনের হামলা তো কিছু বলেন নাই দিন …,,
,7,আপনাকে বললাম। এই কঠিন সময়ে আপনি আমাদের পাশে থাকলে আমাদের বিশাল উপকার হবে। মাদ্রাসা গ্রন্থাগারিক নিয়োগ সম্পর্কে একটু আলোচনা ১৮ জুলাই প্রজ্ঞাপন জারি করার আগের প্রক্রিয়াধীন নিয়োগ গুলো পূর্বের ন্যায় বহাল রাখতে অনুরোধ রইলো,,
,7,সুমন ভাই আমিও আওয়ামীলীগ করি কিন্তু সরকার তো জনগনের মেন্ডেটের না এটা স্বীকার করতে আমার সমস্যা নাই !!! গত দুই দফা কিন্তু এই আমলাদের কারনে আপনারা ক্ষমতা আর এখন আমলাদের পিছনে লেগেছেন !!! দালালী ছেড়ে দেন  ভাই।,1,1 reply
,7,জনাব সুমন সাহেব আপনার বক্ত‌ব্যে আপ‌নি ব‌ল্লেন যে উ‌নি ছাত্রলীগ করত। হ্যাঁ মানলাম কথাটা । কিন্তু আমার প্রশ্ন টা হ‌চ্ছে যে বর্তমান উ‌নি একটা উপ‌জেলা প্রশাস‌নের মূল কর্নধার। ত উ‌নি কেন শুধু মাত্র একটা দ‌লের ভা‌লো চাই‌বে?,,
,7,"সম্রাট, আব্দুল্লা, সাইদ খোকনের মত সারা দেশের হাজারো নেতা কর্মির বিরুদ্ধে ষড়যন্ত্র বন্দ করেন,,,,,,",,
,7,ভাইয়া রাজনীতিবিদ রা আরো ক্ষতিগ্রস্ত হবে যতদিন ওনারা আমলাদের কে তৈল দেয়া বন্ধ না করবে,,
,7,যে সকল ভাই ও বোনেরা দেশে কিংবা বিদেশে চাকুরী কিংবা ব্যবসা করছেন অথবা পড়ালেখা করছেন আপনারা চাইলে আপনাদের কাজের পাশাপাশি অবসর সময়কে কাজে লাগিয়ে অনলাইনে বা অফলাইনের মাধ্যমে বিশ্বের যেকোন জায়গায় থেকে এ পার্টটাইম কাজ করতে পারেন এবং …,,
,7,আসসালামু আলাইকুম সুমন ভাই আপনি একজন আইনের লোক হয়ে যদি না বুজবার  বান করেন তার মানে ঘুম থেকে জাগানো যায় আর ঘুমের বান করে থাকলে তাকে খুব কস্ট লাগে উঠাতে সুমন সাহেব আপনি বলেছেন রাজনৈতিক বিদরা বেশি খতি গোরস্ত আপনি একজন আইনের লোক কোথায় সমুসা আপনি ভালো করে ব…,,
,7,সুমন ভাই সেরনিয়াবাত পরিবারের উপর গুলি।আমরাতো চুনু পুটি। থানার ওসিরা প্রকাশ্যে জয় বাংলা শ্লোগান দেয় আর থানায় গিয়ে কেউ আওয়ামিলীগ পরিচয় দিলে গালাগালি করে টাকা দিলে কাজ হয়।,,
,7,রাজনীতি গণমুখী থাকলে প্রশাসন কখনও ঔদ্ধত্বপূর্ণ হতে পারে না। নিয়োগ ব্যবস্থার স্বচ্ছতার ব্যপারে শুধু প্রশাসন উদাসীন নয় রাজনীতিকরাও সুপারিশ করে থাকেন।,,
