Checker,Annotaions,Comments,ReactCount,ReplyCount
,6,"ষার..... আপনি ঢাবির একজন শিক্ষক হিসেবে আপনার এত সস্তা কমেন্টস দেখলে আশ্চর্য লাগে!  হোমরা চোমরাদের এমন দৃশ্য দেখতে সমস্যা নাই, কিন্তু সাধারন জনগণ ভয় পাবে কেন? আফগানিস্তানে সাধারণ জনগন ও ভীত অবস্থায় আছে।তার মানে আপনি বলতে চাচ্ছেন বাংলাদেশে সাধারন নির্বাচ…",66,18 replies
,6,"ষাড়, তাহলে কি বিএনপি-জামাত আর তালেবান একই জিনিস!?",49,3 replies
,6,"আপনি নির্বাচন কইরেন! জামানত হারাইয়া চুপ করে বসে থাকবেন! জীবনে নির্বাচন নিয়ে মুখ খুলবেন না! যারা স্বাধীনতা বিরোধী, ১৫ আগস্টের নির্মাতা, ২১আগষ্ট গ্রেনেড হামলার পৃষ্ঠপোষক, দেশ অগ্রযাত্রার যারা বিরোধী  তারা যাতে ক্ষমতায় আসতে না পারে। সে জন্য যা যা করা দ…",91,24 replies
,6,"আপনি রাজাকারের সন্তান ,এমন ধারনা হওয়ার আপনার জন্য স্বাভাবিক !",110,11 replies
,6,"খোয়াব দেখেন,টিকে থাকেন; তালেবান স্টাইল সরকারে আপনিই হবেন মোল্লা আসিফ ওমর।",75,4 replies
,6,হেফাজতের ঘেঁটু আসিফ এর প্রকৃত চেহারা বের হয়েছে,76,6 replies
,6,আওয়ামীলীগ সরকার এত বছর ক্ষমতায় কই আপনার তো কিছুই হয়নি। আফগানিস্তান এর নাগরিকের মত আপনাকেও প্লেন ধরতে হয়নি। সেখানে কি হিসাবে আপনি এইসব কথা বলেন। যদি এতই প্রভাব দেখাইতো আপনি ফেসবুকে উন্মুক্ত সমালোচনা করতে পারতেন না বা বিরোধী কিছু লিখতে পারতেন না। আপনারা …,53,9 replies
,6,"এই দৃশ্যের জন্য স্যারের চুলকানি কেন????  মলম লাগান না হলে জিনে ধরবে,,,,,তখন পরীমনিও বাঁচাতে পারবেনা",19,
,6,দীর্ঘ  না পাওয়ার বেদনা মানুষকে পাগলে রুপান্তর করে।সুষ্ঠু নির্বাচন সাধারণ জনগন সকলেই চাই তাইবলে আফগান হতে হবে কেন।হয়তো উনার মনোজগতে তালেবানের বসবাস। এর আগে কখনও উনার সমালোচনা করিনি।আজ না করে পারলাম না।,19,
,6,শুধুমাত্র আপনার মতো কয়েকজনের অবাধ বাকস্বাধীনতার চিত্র দেখার কারণে— সরকারকে বাকস্বাধীনতা নিয়ে সমালোচনা করতে পারি না।,25,2 replies
7,6,বাংগালীরা এতো বোদাই না,51,4 replies
,6,আপনারে সুষ্ঠ বাডাম চালানের আওতায় আনলে আপনিও ঠিক হয়ে যেতেন। সারাদিন মিয়া কি যে ক্যাসেট প্লেয়ার চালান বুঝি না। টকশোর পেমেন্ট দিয়ে আর কয়দিন চলবেন।,215,29 replies
,6,"যে দেশে আসিফ নজরুলের মতো শিক্ষক এই ধরনের  মন্তব্য করতে পারেন সেই দেশের মানুষের গনতান্ত্রিক অধিকার থাকার চেয়ে না থাকাই শ্রেয়, কারন এনারা সুযোগ পেলে বাংলাদেশ কে আর একটি আফগানিস্তান বানাতে ২ মাসের বেশি সময় নিবেনা।",35,11 replies
,6,"একটা জ্ঞান পাপী দেশ বিরোধী ফাজিল লোক কীভাবে মানুষকে বিভ্রান্ত করে যাচ্ছে,, এদের বের করে দেয়া হউক দেশ থেকে এরাই দেশের শত্রু দেশের উন্নয়নের শত্রু দেশের উন্নয়ন হলে এদের শরীর জ্বলে যায়,, ছোটলোকের দল।",29,12 replies
,6,আপনি এই স্বপ্ন দেখেন নাকি মনে মনে এমন কিছু কামনা করছেন ? আর হ্যাঁ আফগান নাগরিকদের দেশ ছাড়ার এমন মরিয়া পরিস্থিতি দেখে আপনার কি খুব খুশি হচ্ছে?,11,
,6,আপনার মানসিক সমস্যা আছে। তালেবান কি ভোটে আসছে?,13,2 replies
,6,আপনি ঢাকা বিশ্ববিদ্যালয়ের কলঙ্ক। মৌলবাদের উস্কানীদাতা।,43,3 replies
,6,নতুন তালেবান এর আমদানি,7,1 reply
,6,"ষাঁড় আফগানিস্তানে যেটা হলো এটাই কি আপনাদের ""সুষ্ঠ নির্বাচন"" এর উদাহরণ?",8,
,6,আপনার জাত ভাইদের ওখানে চলে যাওয়া উচিৎ ।সরকারের উচিৎ আপনার মত আবর্জনা আফগানিস্তানে ভাগারে ছুড়ে ফেলা।,3,2 replies
,6,"সে এজেন্ডা বাস্তবায়নের জন্য ত দিন রাত কাজ করে যাচ্ছেন সমানতালে।আপনাদের অনেক দিনের স্বপ্ন আপনারা হবেন তালেবান, বাংলা হবে আফগান",1,
,6,দেশকে যারা তালেবানি রাষ্ট্র বানাতে চায় তারা এ ধরনের স্বপ্ন দেখে। তোক্কো স্যারের তো আবার স্বপ্নদোষ বেশি হয়।,4,
,6,ষাঁড় কি ইদানীং বেশি উল্টাপাল্টা জিনিস খান?,6,
,6,আসিফ নজরুল বহু আগ থেকেই আওয়ামীলীগের নেতা কর্মীদের এইভাবে প্লেনে উঠাবার স্বপ্ন দেখে এসেছে। বছরের পর বছর যায় কিন্তু ওর তারেকও আর আসেনা স্বপ্নও পূরণ হয়না। মাঝে কয়েকবার ও নিজেই প্লেনে উঠে লন্ডন চলে গেছে। লাভ হয়নি। ফলে স্বপ্ন দোষ টা ওর থেকেই গেলো।,3,
,6,ষার মদ গাজা খাইতে খাইতে মনে হয় খুব বোরিং হয়ে গেছেন। তাই বাংলাদেশ কে আফগানিস্তান বানিয়ে পপি চাষ করতে চাচ্ছেন। আফিম খেলে মনে হয় ছাগলামি ছাড়বেন।,3,
,6,আপনারা বিশব্বিদ্যালয় বসে টাকার বিনময়ে রাজনীতি করেন বলে বাংলাদেশকে অন্য  দেশের সাথে তুলনা করেন। আপনাকে সবাই চিনে ফেলেছে।,3,
,6,"একান্ত অনুগত ও বাধ্যগতদের দ্বারা আর যাই হোক, শিক্ষকতা হয় না; স্বাধীন ও মুক্তচিন্তার অধিকারী হওয়া শিক্ষকতার পূর্বশর্ত।",2,
,6,আপনার তালেবানী চিন্তাধারায় আমরা মুগ্ধ। চালিয়ে যান। ল্যাঞ্জা ইজ ডিফিকাল্ট টু হাইড।,2,
,6,"আসিফ নজরুল নামের যে শিক্ষক সে কিন্তু তার মেধা ও যোগ্যতার জোরে বিশ্ববিদ্যালয়ের শিক্ষক হয়নি  জানিয়ে রাখি যে সে তার ব্যাচে টপার ছিলো না কিন্তু তারপরও কিভাবে শিক্ষক হয়েছে, সেটি জানতে হলে ওর লেখা ""পিএইচডির গল্প"" পড়লেই হালকা ধারণা পাওয়া যায়। ওর বন্ধু ছিলো ছা…",4,
,6,"রাজাকাররা পালায় না,",1,8 replies
,6,আসিফ নজরুল শিক্ষক নামের কলঙ্ক।,1,
,6,ষাড় কী হুদায় কয় এমন বেক্কেল মার্কা স্ট্যাটাসে জন্যই বলে।  বোকাচোদা ঢাকা বিশ্ববিদ্যালয়ের টিচার মৌলবাদকে উস্কানি দেয়।,2,3 replies
,6,"স্যাড়, তালেবানদের পাশে দাঁড়ানোর আপনার দায়িত্ব ও কর্তব্যের মধ্যে পড়ে",3,
,6,"বাংলায় ঘুপটি মেরে থাকা তালেবান জঙ্গি গোষ্ঠীর চরিত্র প্রকাশ পাচ্ছে, এটা বাংলাদেশ আফগান না রে পাগলা, এখন ও সময় আছে ভালো হয়।",4,
,6,আপনি পালাবার পথ রেডি রাখেন এখন,4,1 reply
,6,ধন্যবাদ ষাড়। বাংলাদেশের মানুষকে বিএনপি জামায়াতের আসল স্বরূপ তুলে ধরার জন্য।,4,
,6,সস্তা জনপ্রিয়তা জন্য এই ধরনের বাজে স্ট্যাটাস আপনাকে মানাই না। আপনার তালেবানী চিন্তাধারায় মাধ্যমে বুঝতে পারি  জাতি একজন বেতনভূক্ত সাম্প্রদায়িক  শিক্ষককে আশ্রয়-প্রশ্রয় দিয়ে দেশটাকে তাতেদার রাষ্ট্রে পরিনত উঠে পড়েছে।,2,
,6,"আপনার পরিচয় তো অনেক আগেই দিয়েছেন, নিশ্চয়ই আপনার মতো কিছু লোক তালেবানদের সাথেও আছে!",2,
,6,"আবারও সিরিজ বোমা হামলার সুযোগ পাইবায়,সেইটা বাংলার বুকে হতে দেবনা,নিশ্চিন্তে ঘুমাউ।",2,
,6,"৭১ এ আপনার চাচ্চু, ডেডিরাই পারে নাই টিকতে আর এখন আসছেন কাবুলের বিমানবন্দরের অবস্থা বানাইতে",3,
,6,"এই ড্যান্সিং কার ষাড় কে যদি কুত্তার বাচ্চা বলি, আমার কি পাপ হবে?",3,
,6,তুমি কাবুল চলে গেলে সেখানে তালেবানও তোমাকে চুদবে না।,8,1 reply
,6,"তবে একটা কথা ঠিক বলছিস তুই,বিমানবন্দরে যেসব সাধারণ অসহায় মানুষ অই জঙ্গিরা(আগে ছিল এখন নিজেদের পরিবর্তন করেছে কিনা আল্লাহ ভালো জানে) ক্ষমতা নিয়েছে বলে পালাচ্ছে একটু শান্তিতে বাচতে,সেভাবে বিএনপি আর জামাত আর তর মতো বড় জঙ্গিদের পা চাটা লোকরা ক্ষমতায় আসলে ব…",2,
,6,পরিমনির সাথে দেখা করিয়ে দেওয়া ব্যাবস্থা করতেছি গাঞ্জা একটু বেশি খাইছে,1,
,6,"ওহে জনাব ডেইট ওভার গাজা খেয়ে আপনি মনে হয় ভুলে গেছেন, যে বাংলাদেশ আওয়ামীলীগ পিছনের দরজা দিয়ে ক্ষমতায় আসা দল নয়।বাংলাদেশ আওয়ামীলীগ ত্যাগী কর্মীদের রক্ত ও ঘামের বিনিময়ে ক্ষমতায় আসা দল।আপনাদের মত ছাগলরা ই সমাজের মুর্খ,জ্ঞানহীন বেয়াদপ।",1,
,6,ষারের মনে আজ অনেক আনন্দ তালেবান ক্ষমতায়।আজ থেকে ঠিক ১৬ বছর আগে এই দিনে ষারের সরকারের আমলে একযোগে সারা দেশে বোমা হামলা হয়েছিলো।আমরা তো বুঝি ষারের মনে ব্যথা।কেনো এখনো এই দেশে বোমা হামলায় মানুষ মারা যায় না কেনো বাংলাদেশ এগিয়ে যাবে। বাংলাদেশ থাকবে আফগানিস্…,2,
,6,ষাড় আপনার মানসিক চিকিৎসার দরকার। আপনি যত তাড়াতাড়ি সেটা বুঝতে পারবেন জাতির জন্য এবং আপনার নিজের জন্যও সেটা তত তাড়াতাড়ি  মঙ্গলজনক হবে।,1,
,6,ছ্যার আপনার পীরের বক্তব্য শুনেন তো একবার ।,1,
,6,"আমেরিকার সেনাবাহিনীর কুকুর গুলো  করে নিয়ে গেছে,, কিন্তু আমেরিকার পা চাটা গোলাম গুলো তালেবান দের হাতে রেখে গেছে,,, তার পরও  তালেবানের নেতারা পা চাটা গোলামদের জন্য সাধারণ ক্ষমা ঘোষণা করেছে এটাই ইসলাম।",,
,6,মেয়াদ ছাড়া লাল পানি খেয়েছেন নাকি?,3,
,6,"চেতনাবাজদের জ্বালাপোড়া শুরু হয়েছে, নিজেরা অসভ্য হওয়া স্বত্তেও তারা মৌলবাদ জঙ্গিবাদ বলে গলা ফাটায়।",,
,6,"আর দেশ থেকে যদি লম্পট উচ্ছেদ অভিযান শুরু হয়,আপনি আসিফ নজরুল লম্পট এয়ারপোর্টে গিয়ে প্লেন ধরা তো দূরের কথা সদর ঘাটের লঞ্চ ধরে পালাতে চাইবেন....",1,
,6,"ষাঁড়, সবকিছুতেই কি একই স্বপ্ন দেখা হয়??",1,
,6,"আসিফ নজরুল ষাড়, ডিম খাওয়ার জন্য রেডি থাকেন। ৬০/২০ খান না  দেখেই এতো স্পর্ধা বাড়ছে,এক দুইবার ৬০/২০ খাইলেই বুঝবেন। নিজের এলাকায় মেম্বার  নির্বাচন  করলেও ত আপনি জামানত হারাবেন মিয়া।",,
,6,বিদেশে বসে দেশ নিয়ে আপনার ভন্ডামি কথাবার্তা বলা বন্ধ করেন....! দেশে প্রতিটা নির্বাচন সুষ্ট হচ্ছে..আপনি আসিফ সাহেব দালালির চাশমা পড়ে আছেন বলে দেখছেন না,,
,6,ব্লু ভেরিফাইড পাওয়া  ফেবুর এই আইডি নিশ্চয়ই আপনার নিজস্ব। এটা তো আর ফেইক আইডি হতে পারে না।   তবে কেন শব্দচয়নে এতো বেমানান।,,
,6,"আপনি কি চান দেশ এরকম  রাষ্ট্র তালেবানীয় রাষ্ট্র মতো হোক!  নাকি অযোগ্যদের ভোট মূল্যহীন বলছেন! আপনি কি এটাই এই রকম অবস্হা আমার দেশের মানুষদের হোক, উড়ন্ত প্লেন থেকে পড়ে মরছে এরকম দৃশ্য দেখতে চান!",,
,6,আপনার মত বদমাইশ টাইট শিক্ষক এখানে কিভাবে ঢাকা বিশ্ববিদ্যালয় পড়ে রইছেন বুঝি না দেশ বিরুদ্ধী দালাল কোথাকার।,,
,6,আঙ্কেল সুষ্ঠু নির্বাচনে সীল মারাবো কি শীলা ভাবির দুই ঠেং এর মাঝখানে?,3,
,6,জেগে জেগে খারাপ স্বপ্ন দোষ হলে ত ফরজ গোসল করা প্রয়োজন।,1,2 replies
,6,ষাঁড় কে কেউ একটা প্রতিক দিয়ে দাড় করাই দে ভাই!,5,
,6,"পাগলের প্রলাপ,,আপনার গোলাপী মা কখন সুস্হ নির্বাচন দিয়েছিল সেটা একটু শুনি?",,
,6,আচ্ছা ষ্যার তোকে যদি আফগানিস্তান বা আমেরিকা যাবার ফ্রি ভিসা দেওয়া তুই কোন দেশে যাবি??,1,
,6,আসিফ নজরুল ষাঁড় কি শেষমেশ স্বীকার করলেন ওনার পিও বিএনপি-জামায়াত আসলে বাংলাদেশের তালিবান?,1,
,6,ষাঁড় তাহলে কি আপনার গুরুরা তালেবান সেটা স্বীকার করেই নিলেন???,1,
,6,এই চিন্তায় ঘুম কামাই কইরা কোন লাভ নাই ষাড়....আপনাদের মতো অনেকেই এরকম সপ্ন দেখেছে কিন্ত শেষ পর্যন্ত তারা ইতিহাসের আস্তাকুঁড়ে নিক্ষিপ্ত হয়েছে। আপনার এত পিরিত উঠলে পেয়ারা পাকিস্তান বা আফগানিস্তানে চলে যান। আপনারে কেউ ধইরা রাখে নাই।,1,5 replies
,6,"আসিফ ষ্যাড় জীবনে একটা ইচ্ছে আছে- আপনারে পাইলে পঁচা ডিম মারতাম। শুনেছি পুলার রোডেই থাকেন, আচ্ছা ওক্কেহ্ ঘুরাঘুরি করমু ওইদিকে‚ যদি পাপে দোচে তো আমার সাম্নে পড়বেন",11,
,6,আপনি তো খুব ভালো উস্কানি দিতে পারেন। বিএনপির উইত আপনাকে ভালো উস্কানিদাতা হিসেবে নিয়োগ দেওয়া। কিন্তু দুঃখজনক বিষয় হচ্ছে বাংলাদেশের মধ্যে ঘৃহযুদ্ধ করবে কারা?? এমন কে আছে এই দেশে?? আর কি কারনেই বা করবে??,,
,6,তা আফগানিস্তানে কেমন নির্বাচন হল জনাব আসিপ সাপ?,1,
,6,আসিফ নজরুল ষাঁড় শেষমেশ স্বীকার করলেন ওনার পিও বিএনপি-জামায়াত আসলে বাংলাদেশের তালিবান.,,
,6,"মাইর খাওয়ার ধান্ধায় আছেন মনে হয়? রকেটের পাছায় করে,আপনাকে আফগানিস্তানে পাঠানোর ব্যবস্থা করতে হবে মনে হয়।",,
,6,ষাড় আফগানিস্তানে কি গনতন্ত্র প্রতিষ্ঠা হইছে?,,
,6,মেয়দ উত্তির্ন গঞ্জিকা টা একটু বেশি খেয়ে ফেলছেন মনে হচ্ছে।,,
,6,"স্যার সাবধানে ঘুমাইয়েন,স্বপ্নদোষ যেন না হয়!",7,1 reply
,6,এর ডোজ বেশি পরে গেছে।,,1 reply
,6,"আসিফ নজরুল ষাঁড়ে লিসা করছে, তাছাড়া হালারে দেখতেই তালেবানের সন্তান দের মত লাগে..!!",,
,6,আপনাকে আগে কান ধরে উঠবস করানো হবে---,,
,6,প্রথম আলোর ফরমায়েশ খাটতে গিয়ে নিজের সম্মান এভাবে নিলামে উঠানো উচিত হয়নি।,18,
,6,পরীমনিরা রাতের রাণী হলে যারা তাদের খদ্দর তারা অবশ্যই রাতের রাজা তাই না স্যার? আর সে ক্ষেত্রে তাদেরকে রাতের রাণী বললেতো সমস্যা নেই। তবে অবশ্যই রাতের রাজাদের মুখোশ উন্মোচন হওয়া চাই।,7,
,6,এদেরই পুর্ব পুরুষ মাছুদা ভাট্টিদের চরিত্রা হীনা বলায় দেশের শ্রদ্ধেয় ভাজন ব্যক্তিত্ব ব্যারিস্টার মঈনুল স্যারকে কিন্তু পুরো এই ধরনের সমস্ত নারীবাদীরা মিলে কিন্তু জেল হাজতে প্রেরন করেছিল!!,8,
,6,তাদের প্রতি আপনার এত দরদ উতলে পরছে কেন?,2,
,6,"এই সব রাতের রানী, রক্ষিতা কি হঠাৎ আলাদীনের চেরাগ এর মতো তৈরি হয়????  এদের কে যারা রাতের রানী তৈরি করে,  এবং রক্ষিতা হিসেবে ব্যাবহার করে,  তাদের চেহারা ও জাতি দেখতে চাই। আজকে দেখলাম, মামলার একজন তদন্ত কর্মকর্তা পুলিশের উর্ধতন কর্মকর্তার নাম, সে না কি,  …",,
,6,"এই প্রথম আপ্নার সাথে একমত হলাম। যারা কেবলমাত্র পরিমণিকেই দোষ দেয় তারাই আসল শুয়োরের বাচ্চা। অথচ এই অপরাধে পরিমণি মাত্র ২০ ভাগ দায়ী। ৮০ ভাগ তো অন্য জানোয়ারেরা। সমান হলেও ৫০/৫০, হ",,
,6,আপনি আছিফ নজরুল,,
