Checker,Annotaions,Comments,ReactCount,ReplyCount
,4,"তোমার মত নাস্তিক বিশ্বাস করলে ও কি,, না করলে বা কি,,,!আল্লাহ এক,,,।অবশ্যই পরকাল আছে,,।তুই শুধু মারা যা তারপর তোর কি হবে বাকিটা আল্লাহ জানে,,,,",0,
,4,তার মানে কি তুমি মরবে না।।। পরো কালকে বিশ্বাস করো না।।। তুমি কি মুসলমান আমার তো সন্দেহ হয়,0,
,4,তায়েফ সরকার নাস্তিক,0,
,4,"কমেন্টস গুলো দেখ ভাল ভাবে। Md Monjur Miya, মুসলিম মোরা ভাই ভাই",0,
,4,সেলিব্রেটি হওয়ার জন্য ধর্ম ব্যাবহার করবেন না,0,
,4,"অতিরিক্ত সবই খারাপ,,,, বেশি জনপ্রিয়তা পাইয়া সব ভুলে গেছে,,,, এখন বাইচা থাকলেও সবাই বাশ দিবে ।। মরলে তো কথাই নাই,,নাস্তিক কোথাকার",0,
,4,তর বাপ নাস্তিক! তার ঘরে তুই ভাল হইবি কেমনে,1,
,4,হিন্দু কাফির,0,
,4,"আপনি যে নিজের ক্যারিয়ার বাচাতে এই পোস্ট করেছেন সেটা সবাই বুঝে। আপনি নাস্তিক, এটা মেনে নিলেই পারেন।",1,
,4,ও তো একজন বেশ্যা। বেশ্যা তো পরকালই মানে না।,0,
,4,"এটা বিশ্বাস হয়না কারণ,তোমার বাবা কড়া নাস্তিক!",0,
,4,চোদনাল্লাহ।,0,
,4,"আমি যদি ভুল করে থাকি মানে কি,এটা দ্বারা বুঝাই যাই যে আপনি এখন ও নিশ্চিৎ নন যে কথাটি ভুল,বাহ,মুসলিম হয়েও নাস্তিকের মত বলে ফেললেন পরকাল বিশ্বাস করেন্না..অথচ,আপনি আমার fvrt actress ছিলেন",4,
,4,কেমন বিশ্বাস করবে ওরা আল্লাহ খোদা বলে কাউকে চিনেনা৷ ওরা নাস্তিক এর বাচ্ছা।৷,0,
,4,এগুলা সব নাস্তিক এ পরিনত হইছে,0,
,4,তুর নাটক আমি আর দেখব না good bye নাস্তিক,0,
,4,"আপনি আমার একজন প্রিয় অভিনেত্রী ছিলেন,,কিন্তু আপনার নাস্তিক মনোভাবের জন্য আপনাকে প্রত্যাখ্যান করলাম।।আর জাতির কাছে ক্ষমা চাইতে হবেনা,আপনি নামাজ পড়ে সৃষ্টিকর্তার কাছে ক্ষমা চান৷।",1,
,4,নাস্তিকের ঘরেতো নাস্তিক হবে,2,
,4,"জানোয়ারের বাচ্চা, খানকি মাগী,। তুই বিশ্বাস করবি নাকি করবি না, সেটা তর ব্যাপার। কিন্তু মুসলমানের নাম রেখে মুসলিম ধর্মে থেকে নাস্তিকতা করবি প্রকাশ্যে। এটা মেনে নিতে পারি না। তর এত বড় সাহস প্রকাশ্যে নাস্তিকতা করস।",5,
,4,"আনফ্লো করেন সবাই, নাস্তিক কে",2,
,4,নাস্তিক অভিনেত্রী। জাহান্নামে যাও। তুমি ধংস।,0,
,4,তোর পোন্দানিতে নুসরাতের হত্যার প্রতিবাদ টি হোগামারা খাচ্ছে। নুসরাতকে তো অন্যায়ভাবে পুডানো হইছে। এখন যদি পাব্লিক জনসম্মুখে তোরে পুডাইতো.. নাস্তিকের বাচ্চা,1,
,4,তাহলে গুয়া মারা দিয়া খাও পরে টের পাইবা। দুনিয়াতেই আগে পরে আখেরাতে। নাস্তিক এর বাচ্চা।,1,
,4,"তুমিতো আল্লাহ কে দেখোনি,,আবার আল্লাহর কাছে ক্ষমা চাও কেমনে? নাস্তিক আবার ঢং সোদায়",1,
,4,"পেইজটিকে সবাই আনলাইক দিন,,,দেখবেন এমনি সোজা হয়ে যাবে নাস্তিক টা",0,
,4,তওবা করে একটা দ্বীনদার ্রছরলেকে বিয়ে করে লাইভে ক্ষমা চেয়ে প্রমান কর তুমি মুনাফেক- নাস্তিক নও।,2,
,4,নতুন নাস্তিক এর দেখা পাওয়া গেছে,1,
,4,এটাও নাস্তিকের খাতায় নাম লেখছে,0,
,4,সৃষ্টিকর্তার যদি অস্তিত্ব না থাকে তাহলে তুই নিজে একবার মরে আবার বেঁচে দ্যাখ ্যা,0,
,4,সেই দিন আর বেশি দূরে নাই ভারতের মতো বাংলাদেশেও মুসলিমদের নির্যাতিত করবে মালুরা।,1,
,4,"মিডিয়া নাস্তিকদের পক্ষে কাজ করছে , এদেরকে উস্কে দিচ্ছে এবং তা প্রচার করে সহায়তা করছে । কে সৃষ্টিকর্তায় বিশ্বাস করলো বা করলো না তাতে কারো কিচ্ছু যায় আসে না কিন্ত মিডিয়া প্রচার করলে সামাজিক শৃঙ্খলা নষ্ট হয় ।",0,
,4,"আজকে গালি দেবনা,,,নাহলে নাস্তিকের বেডি নাস্তিকি,তোরে মাঘীর জ্বি হান্কির জি চুধানির জি নাস্তিকের জি চুতমারানি এই সব গালি দিতাম!!!!",0,
,4,তর মাঝে আল্লাহ নিয়ামত হক আমি মনে করি,0,
,4,ঐ মেয়ে মসুলমানের ইমান নষ্ট করার ব্যার্থ চেষ্টা করতেছে। কোটি কোটি মসুলমানের মনে কষ্ট দিয়েছে।,3,
,4,"তুর নাস্তিক এর মারে লই,,,শালার মাগির গরের মাগি,,,",1,
,4,"চুদানি খানকি,পুটপাতের মাগি,,,,চুদমারানি,,,,তুকে খুব বেশি পছন্দ করতাম,তুর নাটক একটাও মিস করতাম না খানকি মাগি,,,তুকে কুকুর দিয়ে চুদা দরকার,শালার নাস্তিক মাগি",1,
,4,তুর নাস্তিকের মারে চুদি,0,
,4,"যদি কথাটা কেন ব্যবহার করছেন, আপনি তো অবশ্যই ভুল করেছেন মহা ভুল,আপনার মতো সাফা নাটকের নায়িকা আল্লাহকে পরকাল কে বিশ্বাস না করলে আল্লাহর কিচ্ছু আসে যায় না,পৃথিবীতে সাড়ে সাতশো কোটি মানুষের অর্ধেকেরও বেশি আপনার মতো নাস্তিক কিন্তু সেটা আপনি প্রকাশ করতে গেলেন কেন?আপনি আমার অনেক প্রিয় অভিনেত্রী ছিলেন এখন ঘৃণ্য ব্যক্তি,,,",0,
,4,তুমার মত নাস্তিকের বিচার আল্লাহ কেন করবেন।,0,
,4,মাদারচোদ মাগী। নাস্তিক মাইরে চুদি,0,
,4,"তওবা করে এখনই ফিরে আয়,, তা না হলে তর অধপতন জাতি খুব শীগ্রই দেখবে #ইনশাল্লাহ",2,
,4,"ফকিন্নির বাচ্চা,,,,নাস্তিকরা দুচাও....",0,
,4,আল্লাহ কাছে তওবা করে এইসব কাজ ছেড়ে দাও। পরকালের জন্য কিছু করো এবার। তুমার এই নাটক বা মডেলিং কবরে যাবে না।,2,
,4,নাস্তিকের জায়গা বাংলার মাটিতে নেয়....,0,
,4,আপনার কি রোজা নাই।,0,
,4,নাস্তিক কাফের তোরে আল্লাহ হেদায়েত দিউক,0,
,4,"নিজের ফ্যান, ফলোয়ার বাড়ানোর ধান্দা ক্যারিয়ার এর জন্য এরা সকালে নাস্তিক আর রাতে আস্তিক ও হতে পারে",1,
,4,নাস্তিক মোশাররফ করীমের নাটক দেখা বাদ দিয়েছি অনেক আগে... এখন আর এক নাস্তিক সাফা কবির যা তোর ও নাটক দেখা বাদ দিলাম,0,
,4,তোর মত নাস্তিক কে আর লাইক দিবনা তোকে অনেক ভাল লাগত,0,
,4,কিরে কুত্তা কবির তোর বাপ রে বিশ্বাস করস তো?তোর আসল বাপ কি না??নাস্তিক পরকালে বিশ্বাস করে না সে মরার পর পাছা দিয়া গরম রড ঢুকাইলে সব বুঝবা,2,
,4,যে দিন তোর কবরের আতালি কাটবে সেইদিন বিশ্বাস করবি আছে কিনা,1,
,4,প্রথমত তুমি কাফির হয়ে গেছ আর দ্বিতীয়ত এখানে লিখছ যদি ভুল করে থাকি। তার মানে নিজের ভুল এখনো মানতে নারাজ,3,
,4,গাছ থেকে ফল হয়। গাছ যখন নাস্তিক ফল কি করে আস্তিক হবে,0,
,4,নাস্তিকের পরম করুণাময় আছে নাকি আবার,1,
,4,এসব নাস্তিকদের বেলুন ফেটে জন্ম হয় ।,1,
,4,কাজী রাজন শালি এখন চোদাই পরে মাপ চাইছে।আসলে কিন্তু ঐই নাস্তিক।,0,
,4,"তুই নাস্তিক, আল্লাহ তোর ভিতরের মনটাকে মহর মেরে দিয়েছে।",0,
,4,"নাস্তিক, আল্লাহ তোর বিচার করবো",0,
,4,নাস্তিক চুদমারানি বেশ্যার বাচ্চা খানকি মাগী তোর বাপকে বিশ্বাস করিস কিভাবে??,1,
,4,"তুই পরকাল বিশ্বাস করিসনা নাস্তিক মেয়ে? তুই কি দেখেছিস, তোর বাপের এক ফোটা পানি থেকে তুই জন্ম নিয়েছিস দেখিস নি",0,
,4,সৃষ্টিকর্তা না থাকলে তুই এলি কোত্থেকে? সৃষ্টিকর্তা দরকার না থাকলে তুই এলি কিভাবে?,25,
,4,"তুইতো ইহুদীদের মতো কথা বলছিস.তুই একটা নাস্তিক, অার নাস্তিকের কোন জায়গায় নেই বাংলার বুকে।",0,
,4,"তার মানে আপনে ভিডিওতে যা বলেছেন তা সঠিক নাউজুবিল্লাহ, আমি বিশ্বাস করতে পারি না আপনার কাছ তেকে এই রকম বিহ্যাব, আসলে নাস্তিক ঐটা সরাসরি বলিলে উপক্রিত হতাম।",1,
,4,নাস্তিকের হাতে আবার আল্লাহ.... ছিঃ ছিঃ তোদের কারণে আজ দেশে নষ্ট হচ্ছে হাজার হাজার ছেলে মেয়ে... আল্লাহ তদের উপর গজব নাজিল করুন.... তদের মত কুত্তা কবিরের পরিবার বাংলাদেশের জন্য এক অভিশাপ..... আল্লাহ যেন আমাদের হেফাজত করেন এই কুত্তা কবির পরিবারের কাছ থেকে...,0,
,4,"ওর বিচার চাই,,,,,,ইসলাম নিয়ে বারা বারি চলেনাএকটা পতিতা কি বলে হুম",0,
,4,"প্রিয় সাফা কবির,আপনি কি আপনার মা-বাবাকে যৌণ সঙ্গম করতে দেখেছেন?না দেখে কিভাবে উনাদেরকে মা বাবা মেনে নিচ্ছেন??আপনার মা কে জিজ্ঞাস করে নিয়েন যাকে আপনি বাবা ডাকছেন উনি আপনার আসল বাবা কিনা,নাকি অন্য কেউ আছে??কারণ আপনিতো না দেখে কিছু বিশ্বাস করেন নাহ.সাফা কবির যে কিনা মুসলিম হয়েও পরকালে বিশ্বাস করেনা।নব্য নাস্তিক সবাই বয়কট করুন সাফাকে",2,
,4,শালায় একটা নাস্তিক শালারে আগুন লাগায়া দে,1,
,4,নব্য নাস্তিক! যিনি পরকালে বিশ্বাস করেন না! আর উনার যুক্তি যা দেখেন না তা বিশ্বাস করেন না! এখন কিছু প্রশ্ন থেকে যায়! আপনি তো আপনার সেন্স ও দেখতে পান না তাহলে কি আপনি সেন্সলেস! মাথামোটা টাইপের অভিনেত্রী! কোনো কমন সেন্সটাও নাই! ওহ সরি আপনার তো সেন্সই নাই আবার কমন সেন্স!,0,
,4,নাস্তিক এর বাচ্ছা...,0,
,4,এবার তাহলে সাফার পালাআচ্ছা আপু যেইটা দেখেন না বিশ্বাস করেন না?আপনার বাবা যে আপনার মায়ের সহবাস করে আপনাকে জন্ম দিসে সেইটা তো দেখেন নাই!তাহলে কিভাবে বিশ্বাস করেন উনি আপনার বাবা,1,
,4,অতঃপর আরো একজন নব্য নাস্তিক এর জন্ম নিল বাংলাদেশে,0,
,4,"যখন ফেঁসে গেলো তখন, বলে ভুল হয়েগেছে, লোক দেখানো ক্ষমা চাওয়া, মন থেকে তাওবা করলে তো ভালো আর না হয়, নাস্তিক রয়ে যাবে, যেমন টা তোমার বাপে নাস্তিক।",1,
,4,তা হলে কাফের,0,
,4,আবার নতুন নাস্তিকের পরিচয়,0,
,4,এই নাস্তিকের বাচ্চা কে গলা কেটে হত্যা করতে হবে ওর ঈমান ঠিক নাই ও মুসলিম না। ইহুদি বাচ্চা,0,
,4,নাস্তিক এর বাচ্চা জারজা তুই একটা এমন কথা কেম্নে বললি,0,
,4,নাস্তিক তুই তোর মা বাবা কে কি করেব বিশ্বাস করিস না কি মা বাবা কি করছে সব দেখছিলি,0,
,4,"চুপ কর! যে পরকালেই বিসসাস করেনা, সে নাস্তিক ছাড়া আর কি হতে পারে? পরকাল কে বিসসাস না করা মানে আল্লাহর জান্নাত জাহান্নাম বিচার সব কিছু কে অবিসশাস করা। আর যে এগুলা বিসসাস করেনা সে কখোনো মুসলিম হতে পারেনা",0,
,4,ভাই ও মালুর বাচ্চা নাস্তিক তাই ও পরকালকে বিশ্বাস করে না,0,
,4,"নাস্তিক ট্যাগ পেয়ে মাথায় ঘুমটা দিয়ে মুসলিম সাজার ভং হরে, দু হাত একত্র করে জাতির কাছে ক্ষমা প্রার্থনা পোন*দাচ্ছেন ঠাপা কবিরাজ।",18,
,4,নাস্তিক মহিলা।,0,
,4,নাস্তিকের মেয়ে নাস্তিক,0,
,4,"নাস্তিক, জারজ",0,
,4,হিন্দু ভাই যারা আজান তারা ইফতারের আগ পর্যন্ত গালি দেন....ইফতারের পর আমরা আসতেছি.......,0,
,4,নাস্তিকতায় মাখামাখি,0,
,4,আমি মানি উনি নাস্তিক |আমরা যারা এভাবে গালাগালি করতেছি এটাকি ঠিক হচ্ছে আবার জন্ম তুলেও কথা বলতেছি |,0,
,4,ও মুসলমান নামের কলঙ্ক।। ওকে এ দেশ থেকে বিতাড়িত করা দরকার।।,0,
,4,"তোদের এই নিউজাটার জন্যই অপেক্ষা করছিলাম, আমি জানতাম সবাই যখন এই কথাটার বিরোধিতা করবে, ঠিক তখনই একমাত্র তোরাই এই কথার সাধুবাদ জানাবি, কারন নাস্তিক, কাফেরদের তোরা সবসময়ই সাপোর্ট করে এশেছিস।",2,
,4,এটা যে নাস্তিক আর কিছু বলার নাই নাস্তিকের সংজ্ঞা কিসের কথা ভাই,0,
,4,সাফা কবরের বিরুদ্ধে জোর প্রতিবাদ করছি।,0,
,4,রোজা রমজানের দিনে এভাবে চেগাইয়া বসা টা ঠিক হয় নাই ভাই,0,
,4,এই সমস্ত নাস্তিককে না বলুন।,0,
,4,হায় রে মুনাফিক,0,
,4,এই নাস্তিক আল্লাহ যে ক্ষমা করছে কিভাবে জানলি আল্লাহর সাথে কি তোর কথা হইছে। তারাতারি উত্তর দে রিপোর্ট করতে হবে,2,
,4,তুই একটা নাস্তিক মাগি,0,
,4,তা হলে তুই কাফের।,0,
,4,সবচেয়ে বড় বাস্তবতা হলো এরা নাস্তিক হবার পরও মরার পর ঈমাম ডেকে এদের জানাযা পড়ানো হয়... কবর দেয়া হয়....... :-(,0,
,4,তুমি একটা নাস্তিকের পরিচয় দিয়েছো ঐ কথা টা বলে...,0,
,4,এটা নূতন নাস্তিক।,0,
,4,"মাপ চাইলেই হইলো,,নাস্তিকের মন মানষিকতা তো আর দুর করতে পারবি নাহ।",0,
,4,তুই তো নাস্তিক তাহলে কেমনে বিশ্বাস করবে,0,
,4,"আপনি পরকাল বিশ্বাস করেন না, কারণ, আপনি পরকাল দেখেন নি তাই। আপনার কাছে আমার মাএ দুটি প্রশ্ন জানার ছিলঃপ্রশ্ন নং ১ : আপনি তো আপনার মা বাবার মিলন দেখেন নি,তাহলে আপনি আপনার বাবাকে কেন বাবা বলে ডাকছেন????প্রশ্ন নং ২ : পরকাল বিশ্বাস করেন না, আল্লাহকে বিশ্বাস করেন বাহ, আল্লাহর কাছে বিছার ও দেন,এখন প্রশ্ন হল আপনি আল্লাহকে ও তো দেখেন নাই, কি ভাবে বিশ্বাস করে বিচার দিচ্ছেন নাস্তিক আপু........??????আল্লাহ আপনাকে হেদায়েত দান করুক।আমীন।",0,
,4,"আমার ক্রাশ ছিলো,,,এখন দেখি আসল নাস্তিক,,,,এ দিল কিউ তুরা,,ইনারে একটু বাশ দিয়ে যাও সবাই,,",0,
,4,"ছাপা কবির,,, আপনার নাটক ভালো লাগতো কিন্তু যখন শুনলাম আপনি পরকালে বিশ্বাস করেন না, তখন থেকেই আপনার প্রতি ঘৃণা তৈরি হইছে,, আমি একজন মুসলিম হয়ে কোন ভাবে একজন নাস্তিক কে support করতে পারি না,,,",0,
,4,"যারা বলে আমি পরকাল দেখিনা, তাই আমি ওটা বিশ্বাস করিনা,,তাদের মত আচোদা, গন্ড মূর্খ আর দুনিয়াতে নাই।। আফসোস এই সহজ বিষয় টা তোর মত কিছু নাস্তিক এ বিশ্বাস করেনা",1,
,4,সাফা কবিরের চেয়ে বড় নাস্তিক হচ্ছে তাকে যারা সমর্থন করতেছে মিথ্যার বিরোধে প্রতিবাদ করা মুসলমানের কর্তব্য আর যে বলে পাপ অর্জন করে সে হচ্ছে পৃথিবীর সবচেয়ে বড় নাস্তিক,0,
,4,মুরগী কবিরের মাইয়া ফোবো কবির।নাস্তিক মেয়ে নাস্তিক।যারা নাস্তিক তারা বাপ মেয়ে একসাথেই রাত কাটাতে পারে।,0,
,4,তুই তো নাস্তিক তোর কথার কোন দাম নাই,0,
,4,নতুন নাস্তিক সাফা কবির,0,
,4,আল্লাহ তো নেই। ক্ষমা করবে কী করে?আপনার নাস্তিকতা মন আগের মতই আছে৷ এটা জাস্ট ক্যারিয়ার হারানোর ভয়ে বলতেছেন৷ কারণ আপনার কাছে সৃষ্টিকর্তা বিশ্বাসের চেয়ে ক্যারিয়ার বাঁচানো টা বড় কিছু৷,0,
